[I 2025-01-07 22:58:24,224] A new study created in memory with name: no-name-4be0baf1-c763-4b00-a952-69c3c18b807b
[I 2025-01-07 23:02:24,880] Trial 0 finished with value: 37413.920796891754 and parameters: {'iterations': 2477, 'depth': 4, 'learning_rate': 0.01777012961311592, 'l2_leaf_reg': 1.4544031106023256, 'bagging_temperature': 0.5783315265045764, 'random_strength': 1.1404026206344768, 'border_count': 55, 'grow_policy': 'SymmetricTree', 'min_data_in_leaf': 5, 'one_hot_max_size': 5}. Best is trial 0 with value: 37413.920796891754.
[I 2025-01-07 23:06:29,514] Trial 1 finished with value: 37861.94596352051 and parameters: {'iterations': 2540, 'depth': 4, 'learning_rate': 0.014187511611509213, 'l2_leaf_reg': 6.6694931595789475, 'bagging_temperature': 0.010712068170284805, 'random_strength': 1.1030655427290597, 'border_count': 139, 'grow_policy': 'SymmetricTree', 'min_data_in_leaf': 5, 'one_hot_max_size': 3}. Best is trial 0 with value: 37413.920796891754.
[I 2025-01-07 23:18:03,372] Trial 2 finished with value: 28027.538142099846 and parameters: {'iterations': 2757, 'depth': 12, 'learning_rate': 0.08543541415731995, 'l2_leaf_reg': 0.008640941295352452, 'bagging_temperature': 0.8112945888230036, 'random_strength': 0.04119122805678246, 'border_count': 250, 'grow_policy': 'SymmetricTree', 'min_data_in_leaf': 4, 'one_hot_max_size': 5}. Best is trial 2 with value: 28027.538142099846.
[I 2025-01-07 23:22:16,208] Trial 3 finished with value: 32558.13886008356 and parameters: {'iterations': 1668, 'depth': 8, 'learning_rate': 0.02022388242832138, 'l2_leaf_reg': 0.006381068114586802, 'bagging_temperature': 0.7350691745274436, 'random_strength': 0.006040568364401681, 'border_count': 216, 'grow_policy': 'SymmetricTree', 'min_data_in_leaf': 28, 'one_hot_max_size': 9}. Best is trial 2 with value: 28027.538142099846.
[I 2025-01-07 23:26:05,908] Trial 4 finished with value: 30819.730992586505 and parameters: {'iterations': 949, 'depth': 8, 'learning_rate': 0.0652461179590173, 'l2_leaf_reg': 0.022736057893202946, 'bagging_temperature': 0.6701945768879501, 'random_strength': 0.04466690644189126, 'border_count': 190, 'grow_policy': 'Lossguide', 'min_data_in_leaf': 24, 'one_hot_max_size': 7}. Best is trial 2 with value: 28027.538142099846.
[I 2025-01-07 23:34:14,837] Trial 5 finished with value: 34678.589564961956 and parameters: {'iterations': 1952, 'depth': 5, 'learning_rate': 0.010998005275072338, 'l2_leaf_reg': 0.4329175167195166, 'bagging_temperature': 0.9985494934807231, 'random_strength': 0.0025461854391293703, 'border_count': 168, 'grow_policy': 'Lossguide', 'min_data_in_leaf': 18, 'one_hot_max_size': 5}. Best is trial 2 with value: 28027.538142099846.
[I 2025-01-07 23:47:24,005] Trial 6 finished with value: 29154.802924063024 and parameters: {'iterations': 2497, 'depth': 11, 'learning_rate': 0.029975383358474997, 'l2_leaf_reg': 0.19098717316813021, 'bagging_temperature': 0.06845539156515235, 'random_strength': 0.0069689914380657945, 'border_count': 201, 'grow_policy': 'SymmetricTree', 'min_data_in_leaf': 15, 'one_hot_max_size': 9}. Best is trial 2 with value: 28027.538142099846.
[I 2025-01-07 23:52:52,641] Trial 7 finished with value: 31997.06067390982 and parameters: {'iterations': 1247, 'depth': 9, 'learning_rate': 0.029825763229680738, 'l2_leaf_reg': 9.221575479944116, 'bagging_temperature': 0.18677723093712317, 'random_strength': 0.3891730583783767, 'border_count': 158, 'grow_policy': 'Lossguide', 'min_data_in_leaf': 2, 'one_hot_max_size': 3}. Best is trial 2 with value: 28027.538142099846.
[I 2025-01-08 00:00:25,229] Trial 8 finished with value: 28988.86284608869 and parameters: {'iterations': 1299, 'depth': 10, 'learning_rate': 0.18611133643941066, 'l2_leaf_reg': 8.582682831406713, 'bagging_temperature': 0.5813935759164771, 'random_strength': 4.299614072800952, 'border_count': 159, 'grow_policy': 'Lossguide', 'min_data_in_leaf': 26, 'one_hot_max_size': 9}. Best is trial 2 with value: 28027.538142099846.
[I 2025-01-08 00:04:46,233] Trial 9 finished with value: 34789.35617640179 and parameters: {'iterations': 872, 'depth': 6, 'learning_rate': 0.019882421355916873, 'l2_leaf_reg': 0.01247346638684972, 'bagging_temperature': 0.009217884552917055, 'random_strength': 5.211268071721683, 'border_count': 255, 'grow_policy': 'Lossguide', 'min_data_in_leaf': 2, 'one_hot_max_size': 2}. Best is trial 2 with value: 28027.538142099846.
[I 2025-01-08 10:11:58,154] Trial 10 finished with value: 29438.619974570323 and parameters: {'iterations': 3000, 'depth': 12, 'learning_rate': 0.08931465703274577, 'l2_leaf_reg': 0.0014448561129101513, 'bagging_temperature': 0.9765651959712666, 'random_strength': 0.06930796373493103, 'border_count': 87, 'grow_policy': 'Depthwise', 'min_data_in_leaf': 10, 'one_hot_max_size': 7}. Best is trial 2 with value: 28027.538142099846.
[I 2025-01-08 10:23:51,593] Trial 11 finished with value: 28885.469074719353 and parameters: {'iterations': 1531, 'depth': 10, 'learning_rate': 0.19679418648778646, 'l2_leaf_reg': 0.0320338772149298, 'bagging_temperature': 0.3835543573546641, 'random_strength': 0.02110549855088225, 'border_count': 110, 'grow_policy': 'Depthwise', 'min_data_in_leaf': 21, 'one_hot_max_size': 10}. Best is trial 2 with value: 28027.538142099846.
[I 2025-01-08 10:41:04,582] Trial 12 finished with value: 29615.175819230997 and parameters: {'iterations': 1936, 'depth': 12, 'learning_rate': 0.19445629199731987, 'l2_leaf_reg': 0.04427523836631998, 'bagging_temperature': 0.34924513595093704, 'random_strength': 0.022148974933845256, 'border_count': 112, 'grow_policy': 'Depthwise', 'min_data_in_leaf': 20, 'one_hot_max_size': 6}. Best is trial 2 with value: 28027.538142099846.
[I 2025-01-08 10:54:01,709] Trial 13 finished with value: 32521.622743089578 and parameters: {'iterations': 1669, 'depth': 10, 'learning_rate': 0.10359358501762135, 'l2_leaf_reg': 0.002612786148812896, 'bagging_temperature': 0.41152008860045647, 'random_strength': 0.1935030166372581, 'border_count': 34, 'grow_policy': 'Depthwise', 'min_data_in_leaf': 12, 'one_hot_max_size': 7}. Best is trial 2 with value: 28027.538142099846.
[I 2025-01-08 11:16:53,545] Trial 14 finished with value: 29192.844751837085 and parameters: {'iterations': 2984, 'depth': 11, 'learning_rate': 0.131811695839895, 'l2_leaf_reg': 0.09062057394402803, 'bagging_temperature': 0.8024469819471285, 'random_strength': 0.0010127159770659758, 'border_count': 99, 'grow_policy': 'Depthwise', 'min_data_in_leaf': 23, 'one_hot_max_size': 10}. Best is trial 2 with value: 28027.538142099846.
[I 2025-01-08 11:18:34,462] Trial 15 finished with value: 31137.406871952175 and parameters: {'iterations': 579, 'depth': 10, 'learning_rate': 0.059740252644912215, 'l2_leaf_reg': 0.005396488938757214, 'bagging_temperature': 0.2855976087391702, 'random_strength': 0.01885001284620716, 'border_count': 241, 'grow_policy': 'SymmetricTree', 'min_data_in_leaf': 11, 'one_hot_max_size': 5}. Best is trial 2 with value: 28027.538142099846.
[I 2025-01-08 11:27:59,318] Trial 16 finished with value: 28361.29247655765 and parameters: {'iterations': 2190, 'depth': 7, 'learning_rate': 0.13576045777666457, 'l2_leaf_reg': 0.027421709243151075, 'bagging_temperature': 0.4486380598884435, 'random_strength': 0.15856412747771106, 'border_count': 126, 'grow_policy': 'Depthwise', 'min_data_in_leaf': 30, 'one_hot_max_size': 4}. Best is trial 2 with value: 28027.538142099846.
[I 2025-01-08 11:37:36,775] Trial 17 finished with value: 28866.423763126313 and parameters: {'iterations': 2205, 'depth': 7, 'learning_rate': 0.04918925179615455, 'l2_leaf_reg': 0.009120207211272255, 'bagging_temperature': 0.8540182843411901, 'random_strength': 0.23927145116210644, 'border_count': 129, 'grow_policy': 'Depthwise', 'min_data_in_leaf': 7, 'one_hot_max_size': 4}. Best is trial 2 with value: 28027.538142099846.
[I 2025-01-08 11:43:40,756] Trial 18 finished with value: 29431.67837147503 and parameters: {'iterations': 2697, 'depth': 7, 'learning_rate': 0.12080006387482288, 'l2_leaf_reg': 0.10056619773541799, 'bagging_temperature': 0.5021723506264636, 'random_strength': 0.7968612791713827, 'border_count': 75, 'grow_policy': 'SymmetricTree', 'min_data_in_leaf': 30, 'one_hot_max_size': 4}. Best is trial 2 with value: 28027.538142099846.
[I 2025-01-08 11:51:26,484] Trial 19 finished with value: 29045.12899267764 and parameters: {'iterations': 2082, 'depth': 6, 'learning_rate': 0.08285674908938559, 'l2_leaf_reg': 0.0011778788484541674, 'bagging_temperature': 0.6407648697531129, 'random_strength': 0.12722190130480535, 'border_count': 188, 'grow_policy': 'Depthwise', 'min_data_in_leaf': 16, 'one_hot_max_size': 2}. Best is trial 2 with value: 28027.538142099846.
[I 2025-01-08 11:57:35,548] Trial 20 finished with value: 28349.452155020794 and parameters: {'iterations': 2313, 'depth': 9, 'learning_rate': 0.1404851411641842, 'l2_leaf_reg': 0.6163136395467858, 'bagging_temperature': 0.8859136985122238, 'random_strength': 0.05531872031720858, 'border_count': 226, 'grow_policy': 'SymmetricTree', 'min_data_in_leaf': 14, 'one_hot_max_size': 6}. Best is trial 2 with value: 28027.538142099846.
[I 2025-01-08 12:03:37,032] Trial 21 finished with value: 28366.234093087765 and parameters: {'iterations': 2262, 'depth': 9, 'learning_rate': 0.13928728396953957, 'l2_leaf_reg': 1.1790542639165524, 'bagging_temperature': 0.8873612561017297, 'random_strength': 0.0482065080354072, 'border_count': 240, 'grow_policy': 'SymmetricTree', 'min_data_in_leaf': 14, 'one_hot_max_size': 6}. Best is trial 2 with value: 28027.538142099846.
[I 2025-01-08 12:09:40,840] Trial 22 finished with value: 29619.498386921317 and parameters: {'iterations': 2718, 'depth': 7, 'learning_rate': 0.07300933697367275, 'l2_leaf_reg': 0.3330773090128591, 'bagging_temperature': 0.48943164862276367, 'random_strength': 0.09594851198169004, 'border_count': 206, 'grow_policy': 'SymmetricTree', 'min_data_in_leaf': 8, 'one_hot_max_size': 6}. Best is trial 2 with value: 28027.538142099846.
[I 2025-01-08 12:16:01,792] Trial 23 finished with value: 28330.46633702936 and parameters: {'iterations': 2373, 'depth': 9, 'learning_rate': 0.14370583950866148, 'l2_leaf_reg': 1.3234242919104695, 'bagging_temperature': 0.7421062024025533, 'random_strength': 0.010093835583786038, 'border_count': 224, 'grow_policy': 'SymmetricTree', 'min_data_in_leaf': 18, 'one_hot_max_size': 4}. Best is trial 2 with value: 28027.538142099846.
[I 2025-01-08 12:23:22,113] Trial 24 finished with value: 28447.88306209594 and parameters: {'iterations': 2769, 'depth': 9, 'learning_rate': 0.10598965789179293, 'l2_leaf_reg': 2.0714881418596645, 'bagging_temperature': 0.9169049359860709, 'random_strength': 0.009414455790688453, 'border_count': 227, 'grow_policy': 'SymmetricTree', 'min_data_in_leaf': 18, 'one_hot_max_size': 3}. Best is trial 2 with value: 28027.538142099846.
[I 2025-01-08 12:31:10,187] Trial 25 finished with value: 28069.09586176678 and parameters: {'iterations': 2382, 'depth': 11, 'learning_rate': 0.14918562750097233, 'l2_leaf_reg': 3.0385896292721, 'bagging_temperature': 0.7672497083519554, 'random_strength': 0.0025149388431037352, 'border_count': 226, 'grow_policy': 'SymmetricTree', 'min_data_in_leaf': 13, 'one_hot_max_size': 5}. Best is trial 2 with value: 28027.538142099846.
[I 2025-01-08 12:40:21,819] Trial 26 finished with value: 28563.277719992937 and parameters: {'iterations': 2833, 'depth': 11, 'learning_rate': 0.04962908140786971, 'l2_leaf_reg': 3.505730128581801, 'bagging_temperature': 0.7560666240788422, 'random_strength': 0.002868868522451911, 'border_count': 245, 'grow_policy': 'SymmetricTree', 'min_data_in_leaf': 1, 'one_hot_max_size': 5}. Best is trial 2 with value: 28027.538142099846.
[I 2025-01-08 12:49:29,593] Trial 27 finished with value: 28038.00700807794 and parameters: {'iterations': 2388, 'depth': 12, 'learning_rate': 0.16702903357759707, 'l2_leaf_reg': 3.5035207019602845, 'bagging_temperature': 0.7190049141917044, 'random_strength': 0.0012340270803721796, 'border_count': 179, 'grow_policy': 'SymmetricTree', 'min_data_in_leaf': 8, 'one_hot_max_size': 4}. Best is trial 2 with value: 28027.538142099846.
[I 2025-01-08 12:56:53,633] Trial 28 finished with value: 28040.212734478668 and parameters: {'iterations': 1927, 'depth': 12, 'learning_rate': 0.1637476315111648, 'l2_leaf_reg': 3.4033946167608993, 'bagging_temperature': 0.6561363868780216, 'random_strength': 0.001096333648197918, 'border_count': 188, 'grow_policy': 'SymmetricTree', 'min_data_in_leaf': 5, 'one_hot_max_size': 3}. Best is trial 2 with value: 28027.538142099846.
[I 2025-01-08 13:06:41,804] Trial 29 finished with value: 28071.385875514738 and parameters: {'iterations': 2568, 'depth': 12, 'learning_rate': 0.09705147841846075, 'l2_leaf_reg': 4.022883645812684, 'bagging_temperature': 0.668977107583933, 'random_strength': 0.0014132332593945, 'border_count': 176, 'grow_policy': 'SymmetricTree', 'min_data_in_leaf': 5, 'one_hot_max_size': 3}. Best is trial 2 with value: 28027.538142099846.
[I 2025-01-08 13:14:02,123] Trial 30 finished with value: 29197.920504711692 and parameters: {'iterations': 1902, 'depth': 12, 'learning_rate': 0.03408164985296815, 'l2_leaf_reg': 0.9576177076645377, 'bagging_temperature': 0.5633943305567644, 'random_strength': 2.4179929211812023, 'border_count': 180, 'grow_policy': 'SymmetricTree', 'min_data_in_leaf': 8, 'one_hot_max_size': 2}. Best is trial 2 with value: 28027.538142099846.
[I 2025-01-08 13:20:36,285] Trial 31 finished with value: 28064.96586896504 and parameters: {'iterations': 2062, 'depth': 11, 'learning_rate': 0.16634196268635587, 'l2_leaf_reg': 2.5133431281028757, 'bagging_temperature': 0.7965773826076927, 'random_strength': 0.002590067565674671, 'border_count': 214, 'grow_policy': 'SymmetricTree', 'min_data_in_leaf': 4, 'one_hot_max_size': 4}. Best is trial 2 with value: 28027.538142099846.
[I 2025-01-08 13:28:38,900] Trial 32 finished with value: 28041.61137960863 and parameters: {'iterations': 2070, 'depth': 12, 'learning_rate': 0.16886439518625784, 'l2_leaf_reg': 5.083889781386824, 'bagging_temperature': 0.8177881453954087, 'random_strength': 0.004349361387335329, 'border_count': 204, 'grow_policy': 'SymmetricTree', 'min_data_in_leaf': 5, 'one_hot_max_size': 4}. Best is trial 2 with value: 28027.538142099846.
[I 2025-01-08 13:35:45,214] Trial 33 finished with value: 28072.862782375243 and parameters: {'iterations': 1821, 'depth': 12, 'learning_rate': 0.16840497650596525, 'l2_leaf_reg': 5.181659481308675, 'bagging_temperature': 0.6240704004879841, 'random_strength': 0.004685757846651689, 'border_count': 196, 'grow_policy': 'SymmetricTree', 'min_data_in_leaf': 4, 'one_hot_max_size': 3}. Best is trial 2 with value: 28027.538142099846.
[I 2025-01-08 13:45:28,368] Trial 34 finished with value: 28058.797154166226 and parameters: {'iterations': 2560, 'depth': 12, 'learning_rate': 0.10545377642900847, 'l2_leaf_reg': 1.8616945155005646, 'bagging_temperature': 0.7058641109436875, 'random_strength': 0.0015032003135509488, 'border_count': 152, 'grow_policy': 'SymmetricTree', 'min_data_in_leaf': 6, 'one_hot_max_size': 5}. Best is trial 2 with value: 28027.538142099846.
[I 2025-01-08 13:50:24,267] Trial 35 finished with value: 28296.35058903842 and parameters: {'iterations': 1567, 'depth': 11, 'learning_rate': 0.11697296710314685, 'l2_leaf_reg': 0.7554509910233849, 'bagging_temperature': 0.8117122522974769, 'random_strength': 0.0038865562673173508, 'border_count': 176, 'grow_policy': 'SymmetricTree', 'min_data_in_leaf': 9, 'one_hot_max_size': 4}. Best is trial 2 with value: 28027.538142099846.
[I 2025-01-08 13:58:08,131] Trial 36 finished with value: 28468.215755295325 and parameters: {'iterations': 2053, 'depth': 12, 'learning_rate': 0.07119922319083198, 'l2_leaf_reg': 5.6916797088704305, 'bagging_temperature': 0.6980491050173465, 'random_strength': 0.0011023594657900782, 'border_count': 143, 'grow_policy': 'SymmetricTree', 'min_data_in_leaf': 3, 'one_hot_max_size': 3}. Best is trial 2 with value: 28027.538142099846.
[I 2025-01-08 14:00:56,785] Trial 37 finished with value: 31997.682868578177 and parameters: {'iterations': 1773, 'depth': 4, 'learning_rate': 0.16025517958932892, 'l2_leaf_reg': 0.3751586150052036, 'bagging_temperature': 0.9389787694152794, 'random_strength': 0.0018876299348144234, 'border_count': 208, 'grow_policy': 'SymmetricTree', 'min_data_in_leaf': 6, 'one_hot_max_size': 5}. Best is trial 2 with value: 28027.538142099846.
[I 2025-01-08 14:08:22,624] Trial 38 finished with value: 29111.447108708857 and parameters: {'iterations': 2483, 'depth': 11, 'learning_rate': 0.0802589219204024, 'l2_leaf_reg': 9.915350539742832, 'bagging_temperature': 0.5927288706863479, 'random_strength': 0.01258478231372117, 'border_count': 190, 'grow_policy': 'Lossguide', 'min_data_in_leaf': 1, 'one_hot_max_size': 3}. Best is trial 2 with value: 28027.538142099846.
[I 2025-01-08 14:12:06,469] Trial 39 finished with value: 28340.252237644116 and parameters: {'iterations': 1393, 'depth': 10, 'learning_rate': 0.17129338022148655, 'l2_leaf_reg': 0.24127565144831634, 'bagging_temperature': 0.8577437588138404, 'random_strength': 0.004795561924601493, 'border_count': 167, 'grow_policy': 'SymmetricTree', 'min_data_in_leaf': 4, 'one_hot_max_size': 2}. Best is trial 2 with value: 28027.538142099846.
[I 2025-01-08 14:22:56,546] Trial 40 finished with value: 28168.03476078392 and parameters: {'iterations': 2629, 'depth': 12, 'learning_rate': 0.05838876808829494, 'l2_leaf_reg': 0.12475468765221218, 'bagging_temperature': 0.5384013788509371, 'random_strength': 0.03267877536208554, 'border_count': 253, 'grow_policy': 'SymmetricTree', 'min_data_in_leaf': 10, 'one_hot_max_size': 8}. Best is trial 2 with value: 28027.538142099846.
[I 2025-01-08 14:33:46,286] Trial 41 finished with value: 28016.27059929441 and parameters: {'iterations': 2864, 'depth': 12, 'learning_rate': 0.11684581661338442, 'l2_leaf_reg': 1.8333086448589881, 'bagging_temperature': 0.7349600056058765, 'random_strength': 0.0016994593753810136, 'border_count': 161, 'grow_policy': 'SymmetricTree', 'min_data_in_leaf': 6, 'one_hot_max_size': 5}. Best is trial 41 with value: 28016.27059929441.
[I 2025-01-08 14:44:35,971] Trial 42 finished with value: 28030.892379948113 and parameters: {'iterations': 2888, 'depth': 12, 'learning_rate': 0.12599309393093255, 'l2_leaf_reg': 5.906909765984903, 'bagging_temperature': 0.7083410047104695, 'random_strength': 0.0019794710488806187, 'border_count': 165, 'grow_policy': 'SymmetricTree', 'min_data_in_leaf': 6, 'one_hot_max_size': 4}. Best is trial 41 with value: 28016.27059929441.
[I 2025-01-08 14:52:24,728] Trial 43 finished with value: 28470.091920325038 and parameters: {'iterations': 2898, 'depth': 11, 'learning_rate': 0.11363600623560308, 'l2_leaf_reg': 1.5588475376296607, 'bagging_temperature': 0.7090710064529987, 'random_strength': 0.001904188090511722, 'border_count': 163, 'grow_policy': 'Lossguide', 'min_data_in_leaf': 8, 'one_hot_max_size': 5}. Best is trial 41 with value: 28016.27059929441.
[I 2025-01-08 15:03:01,383] Trial 44 finished with value: 28167.480800018424 and parameters: {'iterations': 2865, 'depth': 12, 'learning_rate': 0.08993756150110532, 'l2_leaf_reg': 7.1905151789524995, 'bagging_temperature': 0.6482802807697248, 'random_strength': 0.007443237251144223, 'border_count': 152, 'grow_policy': 'SymmetricTree', 'min_data_in_leaf': 3, 'one_hot_max_size': 4}. Best is trial 41 with value: 28016.27059929441.
[I 2025-01-08 15:11:05,259] Trial 45 finished with value: 31199.738031822617 and parameters: {'iterations': 2650, 'depth': 11, 'learning_rate': 0.011535556940304453, 'l2_leaf_reg': 2.93370978219983, 'bagging_temperature': 0.6101143363971989, 'random_strength': 0.0010083333030966968, 'border_count': 135, 'grow_policy': 'SymmetricTree', 'min_data_in_leaf': 6, 'one_hot_max_size': 3}. Best is trial 41 with value: 28016.27059929441.
[I 2025-01-08 15:22:18,624] Trial 46 finished with value: 28374.82739196031 and parameters: {'iterations': 3000, 'depth': 12, 'learning_rate': 0.19932424155986184, 'l2_leaf_reg': 0.052797788467287506, 'bagging_temperature': 0.6905840433888402, 'random_strength': 0.0032166792407628095, 'border_count': 152, 'grow_policy': 'SymmetricTree', 'min_data_in_leaf': 10, 'one_hot_max_size': 7}. Best is trial 41 with value: 28016.27059929441.
[I 2025-01-08 15:29:50,249] Trial 47 finished with value: 28456.385931229288 and parameters: {'iterations': 2799, 'depth': 10, 'learning_rate': 0.12701716065123536, 'l2_leaf_reg': 0.01441589246569547, 'bagging_temperature': 0.7654675752952652, 'random_strength': 0.0018693134705919298, 'border_count': 180, 'grow_policy': 'Lossguide', 'min_data_in_leaf': 2, 'one_hot_max_size': 5}. Best is trial 41 with value: 28016.27059929441.
[I 2025-01-08 15:33:19,817] Trial 48 finished with value: 30206.783942306727 and parameters: {'iterations': 1106, 'depth': 11, 'learning_rate': 0.038107955789722106, 'l2_leaf_reg': 0.004348775091684444, 'bagging_temperature': 0.8365710730626399, 'random_strength': 0.006412798801032258, 'border_count': 169, 'grow_policy': 'SymmetricTree', 'min_data_in_leaf': 6, 'one_hot_max_size': 4}. Best is trial 41 with value: 28016.27059929441.
[I 2025-01-08 15:42:41,219] Trial 49 finished with value: 28087.856445438476 and parameters: {'iterations': 2463, 'depth': 12, 'learning_rate': 0.09747868445754367, 'l2_leaf_reg': 0.5612677398854425, 'bagging_temperature': 0.7341601480389768, 'random_strength': 0.5006281496605194, 'border_count': 137, 'grow_policy': 'SymmetricTree', 'min_data_in_leaf': 7, 'one_hot_max_size': 6}. Best is trial 41 with value: 28016.27059929441.
